{
  "contains_source_media": false,
  "contract": "crosscorpus-release/v1",
  "created_at": "2026-10-08T00:00:00Z",
  "exports": "included",
  "files": {
    "records": 13,
    "schema": "crosscorpus-package-file/v1",
    "sha256": "964379713cf73ca922b5e4a3009e61d767e3a0d97b8088de58d368a3b2b72ce3"
  },
  "metadata": {
    "access": {
      "level": null,
      "level_state": "undecided"
    },
    "creators": [
      {
        "affiliation": null,
        "affiliation_state": "not_available",
        "name": "Fixture, Person",
        "orcid": null,
        "orcid_state": "not_available"
      }
    ],
    "description": "Synthetic reference fixture. Not a corpus, not a deposit.",
    "funding": [],
    "identifier": {
      "scheme": "doi",
      "value": null,
      "value_state": "not_available"
    },
    "languages": [
      "es"
    ],
    "publication_year": null,
    "publication_year_state": "not_available",
    "publisher": null,
    "publisher_state": "undecided",
    "related_identifiers": [],
    "resource_type": "Dataset",
    "rights": {
      "licence": null,
      "licence_state": "undecided"
    },
    "source_media_statement": "The release derives from broadcast audio. No audio is part of this package.",
    "title": "CO.RA.PAN fixture release 0000-01 (synthetic; not corpus data)",
    "version": "corapan-0000-01"
  },
  "package_id": "corapan-0000-01-archive-fixture",
  "package_kind": "archive",
  "release": {
    "corpus_id": "corapan",
    "release_id": "corapan-0000-01",
    "release_manifest_sha256": "7b9bc9982c8fc83daee3a903ceaa6eafcb04bd7ff320eb7bf92d4812e40d5211"
  },
  "schema": "crosscorpus-package-manifest/v1"
}
